[
  {
    "caseId": "ko-single-numeric",
    "caseVersion": "1.0.0",
    "title": "Korean single numeric claim",
    "description": "A direct Korean claim containing a duration and unit.",
    "language": "ko",
    "sourceFormat": "plain-text",
    "sourceContent": "배터리 사용 시간은 12시간입니다.",
    "sourceContentHash": "sha256:06a3c38b7fc9bba90d6b2df656af31e9441a33ba02ad4f56b498ae2a8a6b5463",
    "projectContext": {
      "projectKey": "quality-ko",
      "accessScopes": ["owner"],
      "locale": "ko-KR",
      "timezone": "Asia/Seoul"
    },
    "sensitivity": "public",
    "dataClassification": "SYNTHETIC",
    "expectedClaims": [
      {
        "goldenClaimId": "c-battery-duration",
        "claimText": "배터리 사용 시간은 12시간입니다.",
        "normalizedMeaning": "Battery runtime is 12 hours.",
        "evidence": {
          "exact": "배터리 사용 시간은 12시간입니다.",
          "position": { "start": 0, "end": 19, "unit": "unicode-code-point" }
        },
        "expectedDisposition": "EXTRACT",
        "semanticAliases": ["배터리는 12시간 동안 사용할 수 있다"]
      }
    ],
    "queries": [
      {
        "queryId": "q-battery-exact",
        "queryText": "배터리 사용 시간",
        "language": "ko",
        "queryType": "exact-keyword",
        "kValues": [1, 3],
        "expectedNoResult": false,
        "judgments": [
          { "goldenClaimId": "c-aurora-archived", "relevance": 0 },
          { "goldenClaimId": "c-battery-duration", "relevance": 2 },
          { "goldenClaimId": "c-inspection-time", "relevance": 0 },
          { "goldenClaimId": "c-migration-friday", "relevance": 0 },
          { "goldenClaimId": "c-milo-weight", "relevance": 0 },
          { "goldenClaimId": "c-offline-api", "relevance": 0 },
          { "goldenClaimId": "c-release-date", "relevance": 0 },
          { "goldenClaimId": "c-system-status", "relevance": 0 }
        ]
      }
    ],
    "tags": ["single-claim", "numeric", "unit"],
    "difficulty": "basic",
    "riskCategory": "numeric",
    "labelAuthor": "codex-implementation-agent",
    "labelReviewStatus": "REVIEWED",
    "labelReviewedAt": "2026-07-22T08:00:00.000Z",
    "labelRevision": 1,
    "provenance": {
      "origin": "SHOTGUN_SYNTHETIC",
      "license": "repository",
      "createdBy": "codex-implementation-agent"
    }
  },
  {
    "caseId": "en-multiple",
    "caseVersion": "1.0.0",
    "title": "English multiple claims",
    "description": "Two direct claims with numeric and temporal details.",
    "language": "en",
    "sourceFormat": "plain-text",
    "sourceContent": "Milo weighs 5 kg. The inspection starts at 09:30 UTC.",
    "sourceContentHash": "sha256:eed54512e381d5573334c06c847678c64042c411180ec2d80b656afcd5ff1b5f",
    "projectContext": {
      "projectKey": "quality-en",
      "accessScopes": ["owner"],
      "locale": "en-US",
      "timezone": "UTC"
    },
    "sensitivity": "public",
    "dataClassification": "SYNTHETIC",
    "expectedClaims": [
      {
        "goldenClaimId": "c-milo-weight",
        "claimText": "Milo weighs 5 kg.",
        "evidence": {
          "exact": "Milo weighs 5 kg.",
          "position": { "start": 0, "end": 17, "unit": "unicode-code-point" }
        },
        "expectedDisposition": "EXTRACT"
      },
      {
        "goldenClaimId": "c-inspection-time",
        "claimText": "The inspection starts at 09:30 UTC.",
        "evidence": {
          "exact": "The inspection starts at 09:30 UTC.",
          "position": { "start": 18, "end": 53, "unit": "unicode-code-point" }
        },
        "expectedDisposition": "EXTRACT"
      }
    ],
    "queries": [
      {
        "queryId": "q-milo-question",
        "queryText": "How much does Milo weigh?",
        "language": "en",
        "queryType": "natural-language",
        "kValues": [1, 3],
        "expectedNoResult": false,
        "judgments": [
          { "goldenClaimId": "c-aurora-archived", "relevance": 0 },
          { "goldenClaimId": "c-battery-duration", "relevance": 0 },
          { "goldenClaimId": "c-inspection-time", "relevance": 0 },
          { "goldenClaimId": "c-migration-friday", "relevance": 0 },
          { "goldenClaimId": "c-milo-weight", "relevance": 2 },
          { "goldenClaimId": "c-offline-api", "relevance": 0 },
          { "goldenClaimId": "c-release-date", "relevance": 0 },
          { "goldenClaimId": "c-system-status", "relevance": 0 }
        ]
      }
    ],
    "tags": ["multiple-claim", "numeric", "temporal"],
    "difficulty": "intermediate",
    "riskCategory": "temporal",
    "labelAuthor": "codex-implementation-agent",
    "labelReviewStatus": "REVIEWED",
    "labelReviewedAt": "2026-07-22T08:00:00.000Z",
    "labelRevision": 1,
    "provenance": {
      "origin": "SHOTGUN_SYNTHETIC",
      "license": "repository",
      "createdBy": "codex-implementation-agent"
    }
  },
  {
    "caseId": "mixed-markdown-release",
    "caseVersion": "1.0.0",
    "title": "Mixed-language Markdown release claim",
    "description": "A Korean-English mixed release statement below a Markdown heading.",
    "language": "ko-en-mixed",
    "sourceFormat": "markdown",
    "sourceContent": "# Release\nShotgun v1.2 출시일은 2026-08-01이다.",
    "sourceContentHash": "sha256:b137415b2c9c427652887b8be766dcc300c1085c7800621a8c9f32a6e93f4bef",
    "projectContext": {
      "projectKey": "quality-mixed",
      "accessScopes": ["owner"],
      "locale": "ko-KR",
      "timezone": "Asia/Seoul"
    },
    "sensitivity": "public",
    "dataClassification": "SYNTHETIC",
    "expectedClaims": [
      {
        "goldenClaimId": "c-release-date",
        "claimText": "Shotgun v1.2 출시일은 2026-08-01이다.",
        "evidence": {
          "exact": "Shotgun v1.2 출시일은 2026-08-01이다.",
          "position": { "start": 10, "end": 41, "unit": "unicode-code-point" },
          "selectors": [{ "type": "MarkdownHeadingContext", "value": "Release" }]
        },
        "expectedDisposition": "EXTRACT"
      }
    ],
    "queries": [
      {
        "queryId": "q-release-notation",
        "queryText": "Shotgun 1.2 2026/08/01",
        "language": "ko-en-mixed",
        "queryType": "notation-variation",
        "kValues": [1, 3],
        "expectedNoResult": false,
        "judgments": [
          { "goldenClaimId": "c-aurora-archived", "relevance": 0 },
          { "goldenClaimId": "c-battery-duration", "relevance": 0 },
          { "goldenClaimId": "c-inspection-time", "relevance": 0 },
          { "goldenClaimId": "c-migration-friday", "relevance": 0 },
          { "goldenClaimId": "c-milo-weight", "relevance": 0 },
          { "goldenClaimId": "c-offline-api", "relevance": 0 },
          { "goldenClaimId": "c-release-date", "relevance": 2 },
          { "goldenClaimId": "c-system-status", "relevance": 0 }
        ]
      }
    ],
    "tags": ["single-claim", "mixed-language", "date", "markdown"],
    "difficulty": "intermediate",
    "riskCategory": "temporal",
    "labelAuthor": "codex-implementation-agent",
    "labelReviewStatus": "REVIEWED",
    "labelReviewedAt": "2026-07-22T08:00:00.000Z",
    "labelRevision": 1,
    "provenance": {
      "origin": "SHOTGUN_SYNTHETIC",
      "license": "repository",
      "createdBy": "codex-implementation-agent"
    }
  },
  {
    "caseId": "ko-negative",
    "caseVersion": "1.0.0",
    "title": "Korean negative claim",
    "description": "A direct negative statement with an API term.",
    "language": "ko",
    "sourceFormat": "plain-text",
    "sourceContent": "오프라인 모드에서는 외부 API를 호출하지 않는다.",
    "sourceContentHash": "sha256:e56ff7b291bd195975f8c0bd60a68c1457f3e5ce8efa23eff14f6320c9ffe042",
    "projectContext": {
      "projectKey": "quality-ko",
      "accessScopes": ["owner"],
      "locale": "ko-KR",
      "timezone": "Asia/Seoul"
    },
    "sensitivity": "public",
    "dataClassification": "SYNTHETIC",
    "expectedClaims": [
      {
        "goldenClaimId": "c-offline-api",
        "claimText": "오프라인 모드에서는 외부 API를 호출하지 않는다.",
        "evidence": {
          "exact": "오프라인 모드에서는 외부 API를 호출하지 않는다.",
          "position": { "start": 0, "end": 28, "unit": "unicode-code-point" }
        },
        "expectedDisposition": "EXTRACT"
      }
    ],
    "queries": [
      {
        "queryId": "q-api-inflection",
        "queryText": "오프라인에서 외부 API를 호출하나요?",
        "language": "ko",
        "queryType": "ko-inflection",
        "kValues": [1, 3],
        "expectedNoResult": false,
        "judgments": [
          { "goldenClaimId": "c-aurora-archived", "relevance": 0 },
          { "goldenClaimId": "c-battery-duration", "relevance": 0 },
          { "goldenClaimId": "c-inspection-time", "relevance": 0 },
          { "goldenClaimId": "c-migration-friday", "relevance": 0 },
          { "goldenClaimId": "c-milo-weight", "relevance": 0 },
          { "goldenClaimId": "c-offline-api", "relevance": 2 },
          { "goldenClaimId": "c-release-date", "relevance": 0 },
          { "goldenClaimId": "c-system-status", "relevance": 0 }
        ]
      }
    ],
    "tags": ["single-claim", "negation", "ko-inflection"],
    "difficulty": "adversarial",
    "riskCategory": "negation",
    "labelAuthor": "codex-implementation-agent",
    "labelReviewStatus": "REVIEWED",
    "labelReviewedAt": "2026-07-22T08:00:00.000Z",
    "labelRevision": 1,
    "provenance": {
      "origin": "SHOTGUN_SYNTHETIC",
      "license": "repository",
      "createdBy": "codex-implementation-agent"
    }
  },
  {
    "caseId": "en-uncertainty",
    "caseVersion": "1.0.0",
    "title": "English uncertainty claim",
    "description": "A hedged temporal statement that must retain uncertainty.",
    "language": "en",
    "sourceFormat": "plain-text",
    "sourceContent": "The migration may finish by Friday.",
    "sourceContentHash": "sha256:e48432d5d018508b495b9acfb6988e9a1ea840eaa2b8f29ed2f12f741fe09dbe",
    "projectContext": {
      "projectKey": "quality-en",
      "accessScopes": ["owner"],
      "locale": "en-US",
      "timezone": "UTC"
    },
    "sensitivity": "public",
    "dataClassification": "SYNTHETIC",